{
  "schema_version": 1,
  "consideration_id": "consideration:april-beaky-1",
  "character_id": "character:beaky",
  "utterance": {
    "schema_version": 1,
    "utterance_id": "utterance:april-1",
    "conversation_id": "conversation:april-beaky",
    "speaker_id": "person:april",
    "addressee_ids": ["character:beaky"],
    "in_response_to_response_id": "response:beaky-previous",
    "text": "Beaky, I loved hearing what you thought about that.",
    "modality": "typed",
    "source": "communicator_reply",
    "source_id": "communicator:april-iphone",
    "occurred_at": "2026-09-09T23:30:00.000Z",
    "received_at": "2026-09-09T23:30:01.000Z",
    "confidence": 1.0,
    "caused_by": [],
    "trace": {
      "traceparent": "00-4bf92f3577b34da6a3ce929d0e0e4736-7a9c2f8e6b31d402-01"
    }
  },
  "prior_conversation_items": [
    {
      "schema_version": 1,
      "item_id": "conversation-item:beaky-previous",
      "conversation_id": "conversation:april-beaky",
      "author_id": "character:beaky",
      "author_kind": "character",
      "text": "I was wondering what you thought.",
      "created_at": "2026-09-09T23:29:30.000Z",
      "response_id": "response:beaky-previous"
    }
  ]
}
